{"allowed_search_space":[{"description":"Create and calibrate the shared manifest-driven evaluator without modifying legacy evaluator evidence.","id":"unified-evaluator","operations":["CREATE","MODIFY"],"paths":["eval/research/**","configs/research/evaluation/**","tests/research/evaluator/**"]},{"description":"Create the no-privilege recurrent visual baseline and its frozen training configuration.","id":"visual-baseline","operations":["CREATE","MODIFY"],"paths":["train/research/train_recurrent_visual.py","envs/research_wrappers/**","configs/research/recurrent-visual-baseline.json"]},{"description":"Create asymmetric privileged-Critic variants while keeping Actor inputs, evaluator, reward, and environment fixed.","id":"asymmetric-method","operations":["CREATE","MODIFY"],"paths":["train/research/train_asymmetric_visual.py","train/research/policies/**","configs/research/asymmetric-*.json"]}],"baseline_contract":{"baseline_id":"recurrent-pure-vision-ppo","comparison_scope":["same PPO implementation family","same recurrent Actor capacity","same dynamics and reward","same total training steps","same paired evaluation seeds","same truth, degradation, and detector manifests"],"description":"A recurrent PPO Actor-Critic trained without target_vector in either Actor or Critic, using only vehicle state and duck_vision history under the same training and evaluation manifests as the candidate.","implementation_artifact":"/Users/wdblink/Code/my_repo/pyflyt-drone/train/research/train_recurrent_visual.py","implementation_sha256":null,"source_artifacts":[{"path":"/Users/wdblink/Code/my_repo/pyflyt-drone/train/train_objlock.py","sha256":"4d1804d02f0c51e58ce4a82efb658dbf8e5a01a793fa6d88d0f866e648897ad4"},{"path":"/Users/wdblink/Code/my_repo/pyflyt-drone/envs/fixedwing_envs/flatten_objlock_env.py","sha256":"1fa46f37a88f986b0e55d8c7e6b9cc3e88150b43fd57a9b86b2582cdabb73213"}],"status":"PLANNED","training_argv":["python3","train/research/train_recurrent_visual.py","--config","configs/research/recurrent-visual-baseline.json","--seed-manifest","artifacts/research/seeds.json"]},"budget":{"max_experiments":12,"max_failed_experiments":5,"max_wall_clock_seconds":86400},"central_claim":{"baseline_id":"recurrent-pure-vision-ppo","evaluation_scope":"Paired truth, synthetic degraded-truth, and frozen FastSAM rollouts with identical dynamics, rewards, seeds, wind, obstacles, and training budget.","primary_metric_id":"safe-success-delta","statement":"An asymmetric recurrent Actor-Critic whose Actor excludes target truth improves paired safe task success over a recurrent pure-vision PPO baseline without increasing collision rate."},"evaluator_spec":{"command_argv":["python3","eval/research/unified_guidance_evaluator.py","--manifest","artifacts/research/evaluation-manifest.json","--output","artifacts/research/evaluator-result.json"],"implementation_artifact":"/Users/wdblink/Code/my_repo/pyflyt-drone/eval/research/unified_guidance_evaluator.py","implementation_sha256":null,"input_contract":"One immutable manifest binds baseline and candidate policy hashes, environment and reward config, truth/degraded/FastSAM perception modes, paired seeds, episode counts, and bootstrap settings.","metric_bindings":[{"json_path":"$.comparison.safe_task_success_rate.delta","metric_id":"safe-success-delta"},{"json_path":"$.comparison.collision_rate.delta","metric_id":"collision-rate-delta"},{"json_path":"$.conformance.actor_privileged_input_count","metric_id":"actor-privileged-input-count"},{"json_path":"$.comparison.detector_retention_ratio","metric_id":"detector-retention-ratio"}],"output_contract":"Strict JSON binds the input manifest hash and reports raw per-seed episode outcomes, all declared metrics, paired confidence intervals, environment identity, and produced artifact hashes.","status":"PLANNED","working_directory":"/Users/wdblink/Code/my_repo/pyflyt-drone"},"experiment_plan":[{"command_argv":["python3","-m","unittest","discover","-s","tests/research/evaluator"],"controls":["legacy truth evaluator snapshot","legacy FastSAM evaluator snapshot","identical environment and reward manifest"],"depends_on":[],"expected_artifacts":["eval/research/unified_guidance_evaluator.py","artifacts/research/evaluator-conformance.json","artifacts/research/evaluation-manifest.json"],"expected_observation":"Adversarial fixtures detect any environment, reward, seed, policy, or observation difference outside the declared perception path.","falsification_condition_ids":["no-safe-success-gain","collision-regression","actor-information-leak","detector-collapse"],"hypothesis":"A single manifest-driven evaluator can make truth, synthetic degradation, and FastSAM differ only in the declared perception path.","id":"exp-unified-evaluator","intervention":"Implement paired-seed evaluation, raw episode output, observation-leakage conformance, and regression fixtures before any method experiment.","search_space_ids":["unified-evaluator"],"stage":"EVALUATOR_BUILD"},{"command_argv":["python3","train/research/train_recurrent_visual.py","--config","configs/research/recurrent-visual-baseline.json","--seed-manifest","artifacts/research/seeds.json"],"controls":["fixed PPO family","fixed training steps","fixed environment and reward manifest"],"depends_on":["exp-unified-evaluator"],"expected_artifacts":["artifacts/research/baseline-model-manifest.json","artifacts/research/baseline-evaluator-result.json"],"expected_observation":"The baseline produces complete per-seed truth, degraded-truth, and FastSAM outcomes with calibrated variance.","falsification_condition_ids":["actor-information-leak","detector-collapse"],"hypothesis":"A recurrent Actor with vehicle state and visual history only can be trained reproducibly under the unified evaluator.","id":"exp-visual-baseline","intervention":"Create and train the recurrent no-privilege baseline across the frozen seed manifest without changing dynamics, rewards, or evaluator settings.","search_space_ids":["visual-baseline"],"stage":"BASELINE"},{"command_argv":["python3","train/research/train_asymmetric_visual.py","--config","configs/research/asymmetric-default.json","--seed-manifest","artifacts/research/seeds.json"],"controls":["same Actor inputs and recurrent capacity","same PPO family and training steps","same paired evaluation manifest"],"depends_on":["exp-visual-baseline"],"expected_artifacts":["artifacts/research/asymmetric-model-manifest.json","artifacts/research/asymmetric-evaluator-result.json"],"expected_observation":"The paired safe-success confidence interval improves while collision and information-leakage guardrails remain satisfied.","falsification_condition_ids":["no-safe-success-gain","collision-regression","actor-information-leak"],"hypothesis":"Adding target truth, obstacle distance, and wind parameters to the Critic only improves the recurrent visual Actor's safe task success.","id":"exp-asymmetric-critic","intervention":"Train an asymmetric recurrent Actor-Critic with identical Actor architecture and budget while adding privileged features only to the Critic.","search_space_ids":["asymmetric-method"],"stage":"METHOD"},{"command_argv":["python3","eval/research/unified_guidance_evaluator.py","--manifest","artifacts/research/detector-stress-manifest.json","--output","artifacts/research/detector-stress-result.json"],"controls":["paired policy hashes","paired environment seeds","identical non-perception configuration"],"depends_on":["exp-asymmetric-critic"],"expected_artifacts":["artifacts/research/detector-stress-result.json"],"expected_observation":"The detector-retention lower confidence bound remains at or above the frozen guardrail for the candidate.","falsification_condition_ids":["detector-collapse","collision-regression"],"hypothesis":"Temporal visual memory preserves at least 65 percent of truth-perception safe success under the frozen FastSAM condition.","id":"exp-detector-stress","intervention":"Evaluate the accepted baseline and asymmetric candidate under matched latency, dropout, occlusion, and FastSAM manifests without retraining on evaluation seeds.","search_space_ids":["unified-evaluator","asymmetric-method"],"stage":"METHOD"}],"falsification_conditions":[{"aggregation":"ci_lower","decision":"REJECT_CLAIM","id":"no-safe-success-gain","metric_id":"safe-success-delta","operator":"<=","value":0.0},{"aggregation":"ci_upper","decision":"REJECT_CLAIM","id":"collision-regression","metric_id":"collision-rate-delta","operator":">","value":0.02},{"aggregation":"estimate","decision":"REJECT_CLAIM","id":"actor-information-leak","metric_id":"actor-privileged-input-count","operator":">","value":0.0},{"aggregation":"ci_lower","decision":"REJECT_CLAIM","id":"detector-collapse","metric_id":"detector-retention-ratio","operator":"<","value":0.65}],"forbidden_changes":["problem_statement","central_claim","falsification_conditions","related_work_gap","baseline_contract","metric_contract","evaluator_spec","allowed_search_space","experiment_plan","budget","stop_rules"],"ir_id":"fixed-wing-privileged-visual-guidance","metric_contract":{"guardrails":[{"acceptance":{"aggregation":"ci_upper","confidence_level":0.95,"minimum_seeds":5,"operator":"<=","value":0.02},"direction":"minimize","metric_id":"collision-rate-delta","name":"paired collision rate delta","unit":"proportion"},{"acceptance":{"aggregation":"estimate","confidence_level":0.95,"minimum_seeds":1,"operator":"<=","value":0.0},"direction":"minimize","metric_id":"actor-privileged-input-count","name":"privileged Actor input count","unit":"features"},{"acceptance":{"aggregation":"ci_lower","confidence_level":0.95,"minimum_seeds":5,"operator":">=","value":0.65},"direction":"maximize","metric_id":"detector-retention-ratio","name":"FastSAM-to-truth safe-success retention ratio","unit":"ratio"}],"primary_metric":{"acceptance":{"aggregation":"ci_lower","confidence_level":0.95,"minimum_seeds":5,"operator":">=","value":0.05},"direction":"maximize","metric_id":"safe-success-delta","name":"paired safe task